{
  "slug": "getfy-example-member",
  "name": "Getfy Example Member",
  "version": "1.0.0",
  "description": "Exemplo de painel/slot na área de membros.",
  "type": "member",
  "requires": { "getfy": ">=2.0.0", "plugin_api": 2 },
  "member_area_panels": [
    { "id": "example-member", "label": "Example Member", "export": "MemberPanel" }
  ],
  "frontend": {
    "entry": "dist/plugin-ui.js",
    "manifest": "dist/ui.manifest.json",
    "exports": { "member_area": { "example-member": "MemberPanel" } },
    "member_area": { "example-member": "MemberPanel" }
  }
}
